theme,mentions,share_valid_pct,top_question_groups,representative_quote
Tích hợp vào chương trình học,12,38.70967741935484,Cải thiện công cụ; Đề xuất thúc đẩy; Trang bị/kỹ năng cần có,"Nhà trường chưa có dạy đầy đủ về CI/CD, cần thêm vào chương trình học nếu nhà trường muốn sinh viên tiếp cận được CI/CD"
Nền tảng kỹ thuật DevOps,11,35.483870967741936,Trang bị/kỹ năng cần có; Rào cản; Đề xuất thúc đẩy,"Để áp dụng CI/CD hiệu quả, sinh viên cần có nền tảng tốt về quản lý mã nguồn với Git, biết viết test tự động và hiểu cách container hóa ứng dụng bằng Docker. Bên cạnh đó, kiến thức cơ bản về deployment và môi trường cloud cũng rất quan trọng để giúp sinh viên triển khai và vận hành pipeline CI/CD trong các dự án phần mềm thực tế."
Tăng thực hành/lab/workshop,9,29.03225806451613,Cải thiện công cụ; Đề xuất thúc đẩy; Trang bị/kỹ năng cần có,"Các trường và giảng viên có thể hỗ trợ sinh viên bằng cách tích hợp CI/CD vào các môn lập trình hoặc dự án nhóm, yêu cầu sinh viên sử dụng hệ thống quản lý mã nguồn và thiết lập pipeline tự động cho project của mình. Ngoài ra, giảng viên có thể cung cấp repository mẫu, hướng dẫn cấu hình pipeline và tổ chức các buổi workshop hoặc seminar để sinh viên thực hành và hiểu rõ hơn về quy trình DevOps trong thực tế."
Công cụ CI/CD phổ biến,7,22.58064516129032,Trang bị/kỹ năng cần có; Cải thiện công cụ; Đề xuất thúc đẩy,"Để sinh viên học CI/CD hiệu quả hơn, việc giảng dạy nên tập trung nhiều vào thực hành thay vì chỉ lý thuyết. Sinh viên nên được làm các dự án nhỏ có tích hợp pipeline tự động như build, test và deploy khi push code. Ngoài ra, việc sử dụng các công cụ phổ biến trong thực tế như GitHub Actions, GitLab CI/CD hoặc Jenkins cũng giúp sinh viên dễ hình dung quy trình CI/CD trong môi trường phát triển phần mềm thực tế."
Tài liệu và hướng dẫn rõ ràng,7,22.58064516129032,Cải thiện công cụ; Đề xuất thúc đẩy; Trang bị/kỹ năng cần có,"Các trường và giảng viên có thể hỗ trợ sinh viên bằng cách tích hợp CI/CD vào các môn lập trình hoặc dự án nhóm, yêu cầu sinh viên sử dụng hệ thống quản lý mã nguồn và thiết lập pipeline tự động cho project của mình. Ngoài ra, giảng viên có thể cung cấp repository mẫu, hướng dẫn cấu hình pipeline và tổ chức các buổi workshop hoặc seminar để sinh viên thực hành và hiểu rõ hơn về quy trình DevOps trong thực tế."
Tư duy quy trình và hình dung pipeline,7,22.58064516129032,Cải thiện công cụ; Đề xuất thúc đẩy; Trang bị/kỹ năng cần có,Sinh viên khó hình dung luồng đi của code. Cần sử dụng các sơ đồ luồng (Pipeline Visualization)
Môi trường và hạ tầng thực hành,6,19.35483870967742,Trang bị/kỹ năng cần có; Cải thiện công cụ; Rào cản,"Để áp dụng CI/CD hiệu quả, sinh viên cần có nền tảng tốt về quản lý mã nguồn với Git, biết viết test tự động và hiểu cách container hóa ứng dụng bằng Docker. Bên cạnh đó, kiến thức cơ bản về deployment và môi trường cloud cũng rất quan trọng để giúp sinh viên triển khai và vận hành pipeline CI/CD trong các dự án phần mềm thực tế."
Khác/ý kiến chung,5,16.129032258064516,Dự định áp dụng; Đề xuất thúc đẩy; Trang bị/kỹ năng cần có,Chưa có kế hoạch áp dụng CI/CD
